{
  "$schema": "https://dopejs.dev/schemas/ime-recording-v2.json",
  "version": 2,
  "recordingId": "10000000-0000-4000-8000-000000000001",
  "provenance": "fixture",
  "recordedAt": "2026-08-14T00:00:00.000Z",
  "description": "Deterministic fixture for the IME replay validator",
  "environment": {
    "browser": "fixture-browser 1.0",
    "buildId": "local-uncommitted",
    "deviceId": "local-dev",
    "inputMethod": "fixture-ime 1.0",
    "language": "zh",
    "locale": "zh-CN",
    "mode": "edit-context",
    "os": "fixture-os 1.0",
    "roleId": "desktop-chromium",
    "userAgent": "pingo-ime-fixture/1.0"
  },
  "initialText": "A😀",
  "finalText": "A😀你",
  "finalSelection": { "start": 4, "end": 4 },
  "finalComposing": false,
  "initialVisualViewportHeight": 800,
  "softKeyboardObserved": false,
  "characterBoundsObserved": true,
  "droppedRecords": 0,
  "events": [
    {
      "atMs": 0,
      "composing": true,
      "data": {
        "controlHeight": 100,
        "controlLeft": 10,
        "controlTop": 20,
        "controlWidth": 600,
        "selectionHeight": 50,
        "selectionLeft": 80,
        "selectionTop": 45,
        "selectionWidth": 2,
        "visualViewportHeight": 800,
        "visualViewportOffsetLeft": 0,
        "visualViewportOffsetTop": 0,
        "visualViewportWidth": 390
      },
      "event": "compositionstart",
      "message": "compositionstart",
      "selectionEnd": 3,
      "selectionStart": 3,
      "text": "A😀"
    },
    {
      "atMs": 10,
      "composing": true,
      "data": {
        "controlHeight": 100,
        "controlLeft": 10,
        "controlTop": 20,
        "controlWidth": 600,
        "insertedText": "你",
        "rangeEnd": 3,
        "rangeStart": 3,
        "selectionHeight": 50,
        "selectionLeft": 96,
        "selectionTop": 45,
        "selectionWidth": 2,
        "visualViewportHeight": 800,
        "visualViewportOffsetLeft": 0,
        "visualViewportOffsetTop": 0,
        "visualViewportWidth": 390
      },
      "event": "textupdate",
      "message": "textupdate 3:3",
      "selectionEnd": 4,
      "selectionStart": 4,
      "text": "A😀你"
    },
    {
      "atMs": 15,
      "composing": true,
      "data": {
        "controlHeight": 100,
        "controlLeft": 10,
        "controlTop": 20,
        "controlWidth": 600,
        "firstCharacterLeft": 80,
        "firstCharacterTop": 45,
        "lastCharacterRight": 96,
        "lastCharacterTop": 45,
        "rangeEnd": 4,
        "rangeStart": 3,
        "selectionHeight": 50,
        "selectionLeft": 96,
        "selectionTop": 45,
        "selectionWidth": 2,
        "visualViewportHeight": 800,
        "visualViewportOffsetLeft": 0,
        "visualViewportOffsetTop": 0,
        "visualViewportWidth": 390
      },
      "event": "characterboundsupdate",
      "message": "characterbounds 3:4",
      "selectionEnd": 4,
      "selectionStart": 4,
      "text": "A😀你"
    },
    {
      "atMs": 20,
      "composing": false,
      "data": {
        "controlHeight": 100,
        "controlLeft": 10,
        "controlTop": 20,
        "controlWidth": 600,
        "selectionHeight": 50,
        "selectionLeft": 96,
        "selectionTop": 45,
        "selectionWidth": 2,
        "visualViewportHeight": 800,
        "visualViewportOffsetLeft": 0,
        "visualViewportOffsetTop": 0,
        "visualViewportWidth": 390
      },
      "event": "compositionend",
      "message": "compositionend",
      "selectionEnd": 4,
      "selectionStart": 4,
      "text": "A😀你"
    }
  ]
}
